question,answer,retrieved_sources
What is supervised learning?,Supervised learning is a type of machine learning where the model is trained on labeled data.,Supervised learning is a type of machine learning where the...; Deep learning is a subset of machine learning that...; Natural Language Processing (NLP) is a field of AI...
How does gradient descent work?,Gradient descent is an optimization algorithm used to minimize the loss function.,Gradient descent is an optimization algorithm used to...; Neural networks are computing systems inspired by...; Cross-validation is a resampling procedure used to...
What is the bias-variance tradeoff?,The bias-variance tradeoff is a fundamental concept in machine learning.,The bias-variance tradeoff is a fundamental concept in...; Deep learning is a subset of machine learning...; Ensemble methods combine multiple machine learning...
What are Large Language Models?,Large Language Models (LLMs) are a type of neural network that process and generate human-like text.,Large Language Models (LLMs) are a type of neural network...; Explainable AI (XAI) aims to make the decisions of...; Data preprocessing is a crucial step in machine...
Explain reinforcement learning.,Reinforcement learning is an area of machine learning concerned with how agents take actions to maximize reward.,Reinforcement learning is an area of machine learning...; Supervised learning is a type of machine learning...; Unsupervised learning deals with unlabeled data...
What is cross-validation?,Cross-validation is a resampling procedure used to evaluate machine learning models on limited data samples.,Cross-validation is a resampling procedure used to...; Overfitting occurs when a model learns the training...; Ensemble methods combine multiple machine learning...
What is deep learning?,Deep learning is a subset of machine learning that uses neural networks with many layers.,Deep learning is a subset of machine learning that...; Transfer learning is a machine learning method...; Neural networks are computing systems inspired by...
What is computer vision?,Computer vision is a field of AI that enables computers to derive information from visual inputs.,Computer vision is a field of AI that enables computers...; Natural Language Processing (NLP) is a field of AI...; Deep learning is a subset of machine learning...